{"as_of":"2026-07-28T00:00:00.000Z","intended_use":"research_hypothesis_generation_n_of_1","not_for_diagnostic_use":true,"schema_version":"interpretation-contract.v0.2","states":[{"confidence":0.8,"contributing":[{"biomarker_id":"BM-128","observed_at":"2026-07-15T00:00:00.000Z","reference_interval_id":"RI-062","status":"present"},{"biomarker_id":"BM-139","observed_at":"2026-07-15T00:00:00.000Z","reference_interval_id":"RI-070","status":"present"}],"geometry":{"fma_id":"FMA:9637"},"interpretive_anatomy_source":"curated_table","severity":"mild","sufficient_data":true,"system_id":"metabolic"}],"subject_ref":"urn:uuid:aaaaaaaa-bbbb-cccc-dddd-eeeeeeeeeeee","unrenderable":[]}
