{"as_of":"2026-07-28T00:00:00.000Z","intended_use":"research_hypothesis_generation_n_of_1","not_for_diagnostic_use":true,"schema_version":"interpretation-contract.v0.2","states":[],"subject_ref":"urn:uuid:aaaaaaaa-bbbb-cccc-dddd-eeeeeeeeeeee","unrenderable":[{"confidence":0,"contributing":[{"biomarker_id":"BM-423","observed_at":"2026-07-20T00:00:00.000Z","reference_interval_id":null,"status":"no_reference_interval"},{"biomarker_id":"BM-424","observed_at":null,"reference_interval_id":null,"status":"missing"},{"biomarker_id":"BM-425","observed_at":null,"reference_interval_id":null,"status":"missing"},{"biomarker_id":"BM-426","observed_at":null,"reference_interval_id":null,"status":"missing"},{"biomarker_id":"BM-427","observed_at":null,"reference_interval_id":null,"status":"missing"},{"biomarker_id":"BM-428","observed_at":null,"reference_interval_id":null,"status":"missing"},{"biomarker_id":"BM-429","observed_at":null,"reference_interval_id":null,"status":"missing"},{"biomarker_id":"BM-430","observed_at":null,"reference_interval_id":null,"status":"missing"}],"id":"cbc_block","insufficient_reason":"reference_interval null for BM-423 (D-k)","label":"CBC block — no SystemId home (D-g).","reason":"no_system_id_upstream","severity":"indeterminate","sufficient_data":false}]}
