{"as_of":"2026-07-28T00:00:00.000Z","intended_use":"research_hypothesis_generation_n_of_1","not_for_diagnostic_use":true,"schema_version":"interpretation-contract.v0.2","states":[{"confidence":0.35,"contributing":[{"biomarker_id":"BM-123","loinc_code":"2324-2","observed_at":"2026-07-20T00:00:00.000Z","reference_interval_id":"RI-057","status":"present"},{"biomarker_id":"BM-130","observed_at":null,"reference_interval_id":null,"status":"missing"},{"biomarker_id":"BM-132","loinc_code":"1742-6","observed_at":"2026-07-20T00:00:00.000Z","reference_interval_id":"RI-064","status":"present"}],"geometry":{"fma_id":"FMA:7197","uberon_id":"UBERON:0002107"},"interpretive_anatomy_source":"curated_table","severity":"mild","sufficient_data":true,"system_id":"digestive"}],"subject_ref":"urn:uuid:aaaaaaaa-bbbb-cccc-dddd-eeeeeeeeeeee","unrenderable":[]}
