{
  "schema_version": "interpretation-contract.v0.2",
  "intended_use": "research_hypothesis_generation_n_of_1",
  "not_for_diagnostic_use": true,
  "subject_ref": "urn:uuid:canary-10-cbc-cardiovascular",
  "as_of": "2026-07-28T00:00:00.000Z",
  "states": [
    {
      "system_id": "cardiovascular",
      "severity": "mild",
      "confidence": 0.4,
      "sufficient_data": true,
      "contributing": [
        {
          "biomarker_id": "BM-423",
          "status": "present",
          "observed_at": "2026-07-01T00:00:00.000Z"
        }
      ],
      "interpretive_anatomy_source": "curated_table",
      "geometry": { "fma_id": "FMA:7088" }
    }
  ],
  "unrenderable": [
    {
      "id": "cbc_block",
      "label": "Complete blood count",
      "reason": "no_system_id_upstream",
      "severity": "none",
      "confidence": 0.5,
      "sufficient_data": true,
      "contributing": [
        {
          "biomarker_id": "BM-423",
          "status": "present",
          "observed_at": "2026-07-01T00:00:00.000Z"
        }
      ]
    }
  ]
}
