{"as_of":"2026-07-28T00:00:00.000Z","intended_use":"research_hypothesis_generation_n_of_1","not_for_diagnostic_use":true,"schema_version":"interpretation-contract.v0.2","states":[{"confidence":0,"contributing":[{"biomarker_id":"BM-299","observed_at":null,"reference_interval_id":null,"status":"missing"},{"biomarker_id":"BM-401","observed_at":null,"reference_interval_id":null,"status":"missing"},{"biomarker_id":"BM-434","observed_at":"2026-07-18T00:00:00.000Z","reference_interval_id":null,"status":"no_reference_interval"},{"biomarker_id":"BM-435","observed_at":null,"reference_interval_id":null,"status":"missing"}],"geometry":{"fma_id":"FMA:30317"},"insufficient_reason":"reference_interval null for BM-434 (D-k)","interpretive_anatomy_source":"curated_table","severity":"indeterminate","sufficient_data":false,"system_id":"musculoskeletal"}],"subject_ref":"urn:uuid:aaaaaaaa-bbbb-cccc-dddd-eeeeeeeeeeee","unrenderable":[]}
