{
  "schema_version": "interpretation-contract.v0.2",
  "intended_use": "research_hypothesis_generation_n_of_1",
  "not_for_diagnostic_use": true,
  "subject_ref": "urn:uuid:canary-07-empty-contributing",
  "as_of": "2026-07-28T00:00:00.000Z",
  "states": [
    {
      "system_id": "endocrine",
      "severity": "none",
      "confidence": 0,
      "sufficient_data": true,
      "contributing": [],
      "interpretive_anatomy_source": "curated_table",
      "geometry": { "fma_id": "FMA:9600" }
    }
  ],
  "unrenderable": []
}
