{"as_of":"2026-07-28T00:00:00.000Z","intended_use":"research_hypothesis_generation_n_of_1","not_for_diagnostic_use":true,"schema_version":"interpretation-contract.v0.2","states":[],"subject_ref":"urn:uuid:aaaaaaaa-bbbb-cccc-dddd-eeeeeeeeeeee","unrenderable":[{"confidence":0.6,"contributing":[{"biomarker_id":"BM-079","observed_at":"2026-07-22T00:00:00.000Z","reference_interval_id":"RI-031","status":"present"}],"id":"systemic_inflammation","label":"hsCRP — not anatomical (D-g).","reason":"not_anatomical","severity":"mild","sufficient_data":true}]}
