{"as_of":"2026-07-28T00:00:00.000Z","intended_use":"research_hypothesis_generation_n_of_1","not_for_diagnostic_use":true,"schema_version":"interpretation-contract.v0.2","states":[],"subject_ref":"urn:uuid:aaaaaaaa-bbbb-cccc-dddd-eeeeeeeeeeee","unrenderable":[{"confidence":0.35,"contributing":[{"biomarker_id":"BM-136","observed_at":"2026-07-20T00:00:00.000Z","reference_interval_id":"RI-066","status":"present"},{"biomarker_id":"BM-436","observed_at":"2026-07-20T00:00:00.000Z","reference_interval_id":null,"status":"no_reference_interval"}],"id":"renal_function","insufficient_reason":"reference_interval null for BM-436 (D-k)","label":"Renal markers — no SystemId home (D-g).","reason":"no_system_id_upstream","severity":"mild","sufficient_data":false}]}
