{"as_of":"2026-07-28T00:00:00.000Z","intended_use":"research_hypothesis_generation_n_of_1","not_for_diagnostic_use":true,"schema_version":"interpretation-contract.v0.2","states":[{"confidence":0.13,"contributing":[{"biomarker_id":"BM-001","observed_at":"2026-07-12T00:00:00.000Z","reference_interval_id":"RI-001","status":"present"},{"biomarker_id":"BM-119","observed_at":null,"reference_interval_id":null,"status":"missing"},{"biomarker_id":"BM-197","observed_at":null,"reference_interval_id":null,"status":"missing"},{"biomarker_id":"BM-346","observed_at":null,"reference_interval_id":null,"status":"missing"},{"biomarker_id":"BM-358","observed_at":null,"reference_interval_id":null,"status":"missing"}],"geometry":{"fma_id":"FMA:45656"},"interpretive_anatomy_source":"curated_table","severity":"mild","sufficient_data":true,"system_id":"reproductive"}],"subject_ref":"urn:uuid:aaaaaaaa-bbbb-cccc-dddd-eeeeeeeeeeee","unrenderable":[]}
