{"as_of":"2026-07-28T00:00:00.000Z","intended_use":"research_hypothesis_generation_n_of_1","not_for_diagnostic_use":true,"schema_version":"interpretation-contract.v0.2","states":[],"subject_ref":"urn:uuid:aaaaaaaa-bbbb-cccc-dddd-eeeeeeeeeeee","unrenderable":[{"confidence":0,"contributing":[{"biomarker_id":"BM-431","observed_at":"2026-07-20T00:00:00.000Z","reference_interval_id":null,"status":"no_reference_interval"},{"biomarker_id":"BM-432","observed_at":null,"reference_interval_id":null,"status":"missing"},{"biomarker_id":"BM-433","observed_at":null,"reference_interval_id":null,"status":"missing"}],"id":"immunoglobulins","insufficient_reason":"reference_interval null for BM-431 (D-k)","label":"Immunoglobulins — excluded upstream from SystemId (D-g).","reason":"system_excluded_upstream","severity":"indeterminate","sufficient_data":false}]}
