{"as_of":"2026-07-28T00:00:00.000Z","intended_use":"research_hypothesis_generation_n_of_1","not_for_diagnostic_use":true,"schema_version":"interpretation-contract.v0.2","states":[{"confidence":0.2667,"contributing":[{"biomarker_id":"BM-114","observed_at":null,"reference_interval_id":null,"status":"missing"},{"biomarker_id":"BM-115","observed_at":null,"reference_interval_id":null,"status":"missing"},{"biomarker_id":"BM-386","observed_at":"2026-07-18T00:00:00.000Z","reference_interval_id":"RI-097","status":"present"}],"geometry":{"fma_id":"FMA:9600","uberon_id":"UBERON:0002046"},"interpretive_anatomy_source":"curated_table","severity":"mild","sufficient_data":true,"system_id":"endocrine"}],"subject_ref":"urn:uuid:aaaaaaaa-bbbb-cccc-dddd-eeeeeeeeeeee","unrenderable":[]}
